Country,Tekst,Skoor,Tekst2,Skoor2,Tekst3,Skoor3
portugal,Elected officials are free to determine and implement laws and policies without improper interference by unelected groups.,4,"The country has struggled in recent years with major corruption scandals involving high-ranking politicians, officials, and businesspeople, though many such individuals have been duly prosecuted. In June 2022, former prime minister José Sócrates was ordered to report to the police twice monthly while awaiting trial on charges of money laundering and falsifying documents. He had originally been arrested in 2014.While several laws to enhance accountability and transparency for elected officials were approved in 2019, enforcement and effectiveness remained unproven, and resources for auditors, police, and prosecutors were inadequate. A September 2022 report by the Council of Europe’s Group of States against Corruption (GRECO) concluded that Portugal needs to strengthen its efforts to detect corruption and conflicts of interest, and to monitor and verify high-level officials’ asset declarations. The European Commission’s 2022 report on the rule of law also cited concerns regarding a lack of resources for the prevention, investigation, and prosecution of corruption-related cases. Government statistics showed a significant increase in the backlog of unresolved corruption cases over the past several years.Whistleblower protections are in place, but controversy surrounded the case of Rui Pinto, a hacker-turned-whistleblower who leaked troves of documents related to the business activities of European soccer clubs. His trial on dozens of charges began in 2020 and continued in 2022.",3,"Portuguese law provides for public access to government information and judicial proceedings, and state agencies generally respect this right.",4
qatar,"Decision-making authority is concentrated in the hands of the emir and his family, and the Advisory Council has only limited ability to offset executive power in certain areas. However, in July 2021, the emir granted the Advisory Council legislative powers, including the ability to propose laws and approve or reject the national budget.",0,"The authorities regularly punish lower-level public officials for bribery and embezzlement, but corruption remains a concern. No genuinely independent anticorruption mechanisms hold senior officials and members of the ruling family publicly accountable for the allocation of state resources. In May 2021, then finance minister Ali Sharif al-Emadi was removed from office and detained as part of an investigation into allegations of misuse of public funds and abuse of power.",2,"Official information is tightly controlled, and critics complain of a lack of transparency in state procurement. Although the State Audit Bureau prepares budgets and accounts for government institutions, it does not share their full details with the public or the Advisory Council. A 2016 law empowered the bureau to make some aspects of its audit findings public, but the security ministries remained exempt from its oversight.",1
romania,Elected officials are generally able to craft and implement government policy without outside interference.,4,"High levels of corruption, bribery, and abuse of power persist. Romania maintains a comprehensive anticorruption action plan, though the European Anti-Fraud Office (OLAF) noted in a 2020 report that anticorruption bodies face pressure when pursuing high-level cases.The National Anticorruption Directorate (DNA) previously won international praise for fairly investigating corruption cases and securing convictions of powerful figures. However, the 2018 dismissal of DNA chief Laura Codruţa Kövesi was seen as a blow to its independence. Kövesi won a European Court of Human Rights judgment over her dismissal in 2020. In a September 2022 ceremony marking 20 years of activity, the DNA noted that it had prosecuted more than 15,000 people accused of corruption. However, the institution has not had the power to investigate the judiciary since 2018.",2,"Citizens have the legal right to obtain public information and can petition government agencies for it. However, processes for soliciting participation and input from various stakeholders and civil society experts are poorly defined, and the government widely utilizes emergency ordinances for legislating. COVID-19-related information was sometimes withheld, or was otherwise disseminated slowly, by authorities.",3
russia,"President Putin dominates the political system, along with powerful allies in the security services and the business sector. These groups effectively control the output of the parliament, which is not freely elected. The 2020 constitutional amendments formalized the power of the president over the legislature and allow Putin to retain the presidency until 2036. Legislation passed in 2021 increased political centralization at the expense of regional autonomy. However, the federal authorities have limited ability to impose policy decisions in Chechnya, where Chechen leader Ramzan Kadyrov has been granted unchecked power in exchange for violently suppressing dissent and keeping the republic within the Russian Federation.",0,"Corruption in the government and the business world is pervasive, and a lack of accountability enables officials to engage in malfeasance with impunity. Many analysts have argued that the political system is essentially a kleptocracy, a regime whose defining characteristic is the plunder of public wealth by ruling elites. Some of these elites openly work to fulfill President Putin’s policy aims and receive government contracts and protection from prosecution in return for their loyalty.In December 2022, Putin exempted government officials, including individuals deployed to Ukraine, from following a 2008 anticorruption law that mandated the disclosure of income and assets. Putin’s decree also allowed Russian forces in Ukraine to receive “rewards and gifts” deemed humanitarian in nature.",1,"There is little transparency and accountability in the day-to-day workings of the government, particularly at the federal level where decisions are adopted behind closed doors by a small group of individuals.Official opacity further increased after the war in Ukraine began. The government restricted access to economic statistics, including trade data, as 2022 progressed, while the central bank allowed financial institutions to forgo publishing statements in March. In June, the Duma passed a bill that would make information on Russia’s currency and gold reserves a state secret in its first reading. Russian authorities are similarly opaque about the war itself, providing infrequent updates on casualties and providing figures that observers believe are significant undercounts. Soldiers’ relatives, meanwhile, report receiving misleading or false information about their loved ones.",1
rwanda,"Government policy is largely set and implemented by the executive branch, with the security and intelligence services playing a powerful role, and the president is not freely elected. Parliament, which generally lacks the independence to serve as a check on executive authority, tends to merely endorse presidential initiatives; it is able to play more of an oversight role on issues that are less politically sensitive, such as women’s rights, education, and public health.",1,"The government takes measures to limit corruption, including regular dismissals and prosecutions of officials who are suspected of malfeasance. In 2018, Parliament passed penal code revisions that expanded the list of corruption-related crimes and increased penalties for those convicted. Among other high-profile cases in recent years, a state minister responsible for cultural affairs at the Ministry of Youth and Culture was sentenced to four years in prison on corruption charges in September 2022. A lack of transparency surrounding such prosecutions makes it difficult to assess whether they are politically motivated.There are a number of institutions dedicated to detecting and punishing misuse of public funds, including the Rwanda Public Procurement Authority, the Office of the Auditor General, the Office of the Ombudsman, and specialized chambers for economic crimes. Nevertheless, graft remains a problem, and few independent organizations or media outlets are able to investigate or report on corruption issues due to the risk of government reprisals.",2,"While a 2013 law provides for public access to government information, implementation has been weak. Data published on Sobanukirwa, a website created by the government to ease the process of requesting access to documents, suggest that only a small fraction of requests result in positive and timely responses. Given the government’s active repression of any dissent in recent years, citizens do not have the ability in practice to obtain information about state operations, nor do they have a meaningful opportunity to comment on policy without the threat of punishment.",1
st-kitts-and-nevis,"The elected prime minister, cabinet, and national legislative representatives freely determine the policies of the government.",4,"St. Kitts and Nevis’s anticorruption laws are mostly implemented effectively. The Integrity in Public Life Act (IPLA) was adopted in 2013, establishing a code of conduct for public officials and financial disclosure guidelines. However, its implementation rules were not issued until 2018. In September 2022, Justice Minister Garth Wilkin said that the government would operationalize the IPLA and introduce anticorruption legislation.

In recent years, concerns have been raised about the country’s Citizenship by Investment and Residence by Investment programs. The government has introduced reforms to address criticism, including expanded background checks and enacting stricter escrow-account rules.",3,"The government generally operates with transparency, though it long lacked a freedom of information law, which was finally passed in 2018. The Freedom of Information Act had yet to be implemented by the end of 2022 due to inadequate resources, though Justice Minister Wilkin vowed to make that law operational in a September statement. Legal exemptions protect information related to national security, court proceedings, trade secrets, intellectual property rights, and international relations.",3
st-lucia,"The elected prime minister, cabinet, and Parliament determine the policies of the government without improper interference from unelected entities.",4,"Several state institutions are responsible for combating corruption, including the parliamentary commissioner, the auditor general, and the Public Service Commission, but their effectiveness is limited somewhat by a lack of resources. Under the Special Prosecutor Act, which took effect in August 2022, a special prosecutor is empowered to initiate civil or criminal proceedings against current or former public officials accused of corruption.In 2018, an Organization for Economic Co-operation and Development report criticized the operation of the country’s Citizenship by Investment (CBI) program. In response, St. Lucia has made several improvements. In November 2022, Investment Minister Ernest Hilaire said the government was reviewing the country’s CBI program to bolster its competitiveness but vowed that it would rigorously vet applicants.",3,"The government generally operates transparently. Access to information is guaranteed, and government officials are required to declare their financial assets to the Integrity Commission. However, the commission lacks the enforcement powers necessary to ensure full compliance.",4
samoa,"The prime minister and cabinet determine and implement government policies without improper interference by outside groups. The reluctance of the new FAST government to swear in opposition members of Parliament in the wake of the postelection crisis in 2021 suggested ongoing political dysfunction.The FAST government encountered considerable resistance from within the senior echelons of the public service, which had long worked closely with the HRPP. The clerk of the Legislative Assembly and the attorney general, both of whom were involved in the constitutional crisis, were dismissed in September 2021, as was a top official at the Finance Ministry that August. An “open letter” that month from “affected and concerned public servants” criticized their treatment by the new government and was referred to the Public Service Commission. The FAST government has been restricted in its ability to determine government policy owing to a two-thirds requirement for constitutional amendments. For example, the previous HRPP government passed three laws in December 2020 that greatly alter the legal standing of the Land and Titles Court and reduce the powers of the Supreme Court. Owing to the absence of a two-thirds majority, the FAST government has instead insisted that a procedural technicality allows for the law to be reconsidered, which they began to do in August 2022.",3,"Independent entities including the Office of the Ombudsman, the Public Service Commission, and law enforcement agencies pursue allegations of corruption by public officials. However, corruption remains a problem and a cause of public discontent, and the government has at times resisted calls for a stronger response.",3,"While the government generally operates with transparency, the effectiveness of the state auditing system remains the subject of public debate, and the country lacks a freedom of information law. Journalists report difficulties in getting information out of government, although government ministries often release “puff pieces.”",3
san-marino,The government and legislature exercise their powers without improper interference from unelected entities.,4,"In response to scandals involving high-ranking officials, San Marino has launched a series of programs to combat corruption and money laundering. However, GRECO’s 2020 report called for structural changes to San Marino’s judicial sector in order to prevent unwarranted political influence and to strengthen the country’s anticorruption framework. The report also highlighted the need to adopt a code of conduct for members of parliament. In response, in March 2022 the parliament adopted legislation that introduced a code of conduct for lawmakers, with provisions designed to better manage conflicts of interest and improve transparency through asset declarations. Also that month, the Judicial Council adopted a code of ethics for judges. GRECO officials expressed their approval of these reforms in June.In 2017, several former officials were convicted of bribery, corruption, money laundering, and vote buying as part of their involvement in the so-called Conto Mazzini case. Multiple former captains regent and ministers received prison sentences ranging from two to eight years. In March 2022, after years of hearings, an appellate court upheld most of the convictions but reduced nearly all of the penalties.",4,"Laws providing for the accessibility of government information are in place, and the rules are generally respected in practice. The codes of conduct for public officials that were adopted in 2022 were expected to provide additional transparency.",4
sao-tome-and-principe,"The prime minister and cabinet determine policy under the supervision of the National Assembly and the president. They implement laws and policies without improper interference from unelected entities.In April 2022, then prime minister Bom Jesus requested the dismissal of central bank governor Américo Barros, arguing that he had become politically active as a MLSTP-PSD presidential candidate. The president refused the request and was criticized by Bom Jesus for interfering with the government’s decision-making authority.",4,"Corruption is a major problem. Oversight mechanisms, the opposition, and the media have repeatedly uncovered evidence of official malfeasance, sometimes resulting in dismissals and other repercussions. However, anticorruption laws are poorly enforced. In March 2022, President Vila Nova announced the creation of a committee of “wise men” to curb corruption.In April 2022, an Angolan journalist reported that $20 million in investments routed through Angola and directed to São Tomé and Príncipe went unaccounted for after 2015. The journalist implicated Vila Nova, Trovoada, and a former minister. In June, Attorney General Kelve Nobre de Carvalho requested a new audit into why an inquiry into the matter had been closed.",2,"The government generally does not restrict access to information about its operations. However, there is no specific law guaranteeing public access to government information. Officials rarely disclose their assets and income.",3
saudi-arabia,The kingdom’s only elected officials serve on local advisory councils and have little or no influence over national laws and policies.,0,"Corruption remains a significant problem. Although the government generates massive revenue from the sale of oil, which it redistributes through social welfare programs and as patronage, little is known about state accounting or the various direct ways in which public wealth becomes a source of private privilege for the royal family and its clients. Nontribal nepotism in government is also a challenge.The government has taken some steps to combat corruption and recover misappropriated assets, but its opaque methods have raised serious concerns about politicization and lack of due process. The crown prince heads an anticorruption committee, which in 2017 ordered the detention of more than 300 people, many of whom were coerced into turning over billions of dollars in assets to the state in out-of-court settlements. Mohammed bin Salman’s campaign initially targeted potential rivals within the royal family, leading observers to suggest that these crackdowns are meant to consolidate his political and economic control. Since 2020, the government has shifted its focus to offenses by lower-level officials. In July 2022, the national anticorruption body announced that it had arrested 78 officials accused of bribery, forgery, and money laundering, and 116 were investigated for several other crimes.",1,"The functioning of government is not transparent. The availability of some economic and financial data is improving, including data on the government budget, but overall, whether or how state funds are disbursed and the internal decision-making process that allocates them are unclear. There is no public mechanism for holding senior officials accountable for their decisions. The defense budget is especially shielded from public scrutiny, and the sovereign wealth fund, called the Public Investment Fund, is largely opaque.The state’s oil revenues make up most of its financial resources. In 2019, the state oil company, Saudi Aramco, listed shares on the domestic stock exchange, which requires little transparency, after questions about the company’s relationship with the royal family deterred it from pursuing a public offering on a major international exchange.",0
senegal,"President Sall, his cabinet, and national legislators determine government policies. However, power is concentrated in the executive branch, and the National Assembly is limited in its ability to check the president. The executive has blocked certain parliamentary inquiries into its activities. In May 2019, lawmakers approved a controversial measure to abolish the post of prime minister, which Sall promptly signed. In late 2021, the National Assembly voted to reinstate the position of prime minister, and a Sall appointee gained the post in September 2022.",3,"Corruption remains a serious problem. Anticorruption laws are unevenly enforced and enforcement actions are sometimes viewed as politically motivated. The corruption case against Khalifa Sall, for example, was widely perceived as an effort to neutralize one of the president’s most powerful opponents.In July 2022, the National Office for the Fight against Fraud and Corruption (OFNAC), a government anticorruption watchdog, signed an agreement with several civil society organizations establishing cooperation in implementing the national anticorruption strategy.In December 2022, the Court of Auditors (CDCS) published an audit of public funds allocated to the COVID-19 response. The report identified extensive misuse of funds by the government, prompting public outcry and protests in favor of legal consequences.",2,"The government generally operates with openness. However, authorities frequently award contracts without any formal tender process, and do not always publicly release contracts or bilateral agreements before they are signed.Some decisions related to COVID-19 policies were also made opaquely. In 2020, following complaints to OFNAC over the nontransparent process for distributing pandemic-related food aid, then–community development minister Mansour Faye vowed to refuse any OFNAC summons. Faye was nevertheless appointed infrastructure minister in November 2020, and later became minister for water and sanitation.A 2014 law requires confidential asset disclosures by cabinet members, top National Assembly officials, and the managers of large public funds; the president’s asset disclosures are made public.",3
serbia,"Vučić’s move to the presidency in 2017 raised new concerns about the personalization of governance and politicization of state institutions. Vučić has remained the dominant figure in government despite the presidency’s limited executive powers under the constitution, creating a de facto presidential system. In August 2022, before a new government took office, Vučić announced that the prime minister’s new mandate would extend only until 2024, rather than a full four-year term, due to unspecified “changes to the government.”The executive largely controls the legislative process, and opposition lawmakers are sidelined through the disproportionate use of disciplinary measures, frequent use of accelerated legislative procedures, and late changes to the legislative agenda, among other tactics.",2,"Although the number of arrests and prosecutions for corruption has risen in recent years, high-profile convictions are very rare. Critics have credibly accused Vučić and the SNS government of having ties to organized crime, and cronyism—in the form of jobs provided to allies of the president and the ruling party—is reportedly common. The responsibility for prosecuting corruption cases has been passed among different public prosecutors, who typically fault the police for supplying insufficient evidence in cases against government ministers. The work of the ACA is also undermined in part by the ambiguous division of responsibilities among other entities tasked with combating corruption.Notable cases that came to light in recent years without being resolved include those of Nenad Popović, a politician who was implicated in a questionable privatization that caused an electrical transformer manufacturer to declare bankruptcy; finance minister Siniša Mali, whom anticorruption agencies have investigated for suspected money laundering; and former health minister Zlatibor Lončar, who allegedly has links to an organized crime group. Senior officials’ close relatives and associates have also faced corruption allegations. For example, a series of reports and leaked documents since 2018 tied the father of then interior minister Nebojša Stefanović to an arms-trading scheme and other malfeasance. Aleksandar Obradović, a whistleblower who implicated Stefanović’s father in the purchase of arms from the state at reduced rates, was arrested in September 2019, potentially deterring others with knowledge of corruption from coming forward.",1,"The government has received sustained criticism for a lack of transparency in large-scale infrastructure projects and for secrecy surrounding public tenders. For example, details about the state-funded Belgrade Waterfront project, which includes the construction of hotels and luxury apartments and has been beset by controversy since its announcement in 2012, have not been made available to the public. Serbian defense spending is also opaque. Legislators do not have adequate opportunities to ask questions about government activities and legislation, and the vast majority of parliamentary questions go unanswered by the government.Public officials are subject to asset disclosure rules overseen by the ACA, but penalties for violations are uncommon. While a 2004 freedom-of-information law empowers citizens and journalists to obtain information of public importance, authorities frequently obstruct requests in practice.",2
