Country,Tekst,Skoor,Tekst2,Skoor2,Tekst3,Skoor3
laos,"The government severely restricts freedom of assembly, and protests are extremely rare in practice. In 2022, small demonstrations by unpaid construction workers and farmers involved in a land dispute were disrupted by the military, with arbitrary detentions reported in some cases.",0,"Alongside LPRP-affiliated mass organizations, there are some domestic nongovernmental welfare and professional groups, but they are prohibited from pursuing political agendas. Registration and regulatory mechanisms for nongovernmental organizations (NGOs) are onerous and allow for arbitrary state interference. A harsh decree on associations, which came into force in 2017, mandates that NGOs secure government approval for their initiatives and funding.Human rights and prodemocracy activists are also at risk of unexplained disappearances. In 2019, Laotian prodemocracy activist Od Sayavong disappeared in Bangkok, where he resided. His whereabouts were unknown at the end of 2022. Also in 2019, Phetphouthon Philachane, a Laotian citizen who demonstrated in front of the Laotian embassy in Bangkok, disappeared after returning to Laos. Multiple Thai dissidents have similarly disappeared, or turned up dead, in Laos and neighboring states in recent years.",0,"Most unions belong to the official Lao Federation of Trade Unions. Strikes are not expressly prohibited, but workers rarely stage walkouts. While collective bargaining is legally permitted, workers who try to engage in such activity are usually punished.",0
latvia,"Freedom of assembly is protected by law and generally respected in practice. The government restricted public gatherings as a public-health measure to mitigate the spread of COVID-19 in 2020 and 2021. As of April 2022, most pandemic restrictions were lifted by the government.",4,"The government does not restrict the activities of nongovernmental organizations (NGOs). However, advocacy by NGOs is often viewed as partisan activity.",4,"Workers may establish trade unions, strike, and engage in collective bargaining, and antiunion discrimination is prohibited. In practice, the share of workers covered by collective-bargaining agreements has declined over time and covered around 27 percent of the workforce in 2018, according to the Organization for Economic Co-operation and Development (OECD). A 2019 law imposed fines on employers that refuse to negotiate a collective agreement, among other potential violations.",4
lebanon,"The authorities generally respect the right to assemble, which is protected under the constitution, and people routinely gather without permits or coordination with security services in practice. Demonstrators have been able to protest in recent years against government dysfunction, lack of services, mounting fuel prices, and restrictions on bank withdrawals, but the events have often featured violence by authorities, political parties, militia groups, and civilian participants. Noncitizens, LGBT+ people, and other marginalized groups face greater restrictions on their freedom to assemble in practice. In February 2022, the interior minister asked judicial authorities to prosecute members of a Bahraini Shiite opposition group for organizing events that featured criticism of Bahraini authorities. In June, the minister issued an order to prevent LGBT+ Pride gatherings that “promote homosexuality,” despite rulings by the country’s top administrative court that such actions constituted an infringement on freedom of expression.",3,"Nongovernmental organizations (NGOs) tend to operate freely in Lebanon, though they must comply with the Law on Associations—which has been modified but not comprehensively overhauled since its enactment in 1909—and other applicable laws relating to labor, finance, and immigration. NGOs must also register with the Interior Ministry, which may oblige them to undergo an approval process and can investigate a group’s founders, officers, and staff. NGOs sometimes face bureaucratic obstruction or intimidation by security services, depending on their line of work or particular initiatives. Groups that focus on Syria-related matters or are led and staffed by Syrian refugees are especially prone to scrutiny and interference.",3,"Individuals may establish, join, and leave trade unions and other professional organizations. However, the Labor Ministry has broad authority over the formation of unions, union elections, and the administrative dissolution of unions. The state regulates collective bargaining and strikes. Public employees, agricultural workers, and household workers are not protected by the labor code and have no legal right to organize, though they have formed unrecognized representative organizations. While noncitizen legal residents may join unions under the law, migrant workers have fewer union rights, and large numbers of refugees lack legal status or the right to work.Many unions are linked to established political parties and serve as tools of influence for political leaders. However, activists affiliated with the 2019 protest movement have successfully challenged incumbent forces in recent elections within some unions and professional associations.",2
lesotho,"Protests and demonstrations are permitted, but organizers must seek a permit seven days in advance. In May 2022, 35 demonstrators in the Thaba-Tseka District in Liseleng were beaten, tortured, and arrested by police while protesting month-long cuts to electricity in their village. In June, police reportedly opened fire with live ammunition at protesting students from the National University of Lesotho, killing at least one student and seriously injuring others. The last COVID-19-related restrictions, which included a ban on “strikes, protests, and social gatherings,” were lifted by August 2022.",2,"Nongovernmental organizations (NGOs) generally operate without restrictions. However, some civil society groups act cautiously when working on politically sensitive issues. In addition, government rules on registering NGOs are strict; those who are accused of neglecting to register their organization risk a five-year prison sentence. No NGOs have been held to account for failure to register in recent years.",3,"While labor and union rights are constitutionally guaranteed, the union movement is weak and highly fragmented, and these challenges have undermined unions’ ability to advance the rights of workers—particularly in the country’s largest sector of employment, textiles. The government has previously been accused of undermining bodies like the National Advisory Committee on Labour (NACOLA), the Wages Advisory Board, and Industrial Relations Council. In July 2021, the labor minister announced plans to review the existing labor code and to establish a bargaining council intended to regulate and oversee employment conditions in the country. There were no reported significant developments on these issues in 2022.",2
liberia,"Freedom of assembly is constitutionally guaranteed, and Liberia has a history of public protests and civic actions. Antigovernment protests led by students in late July 2022 encountered violence from young people affiliated with the ruling party that had reportedly been encouraged to attack protesters by state officials. Several gang members were arrested, and President Weah disowned the group in August. Subsequent student protests later in August, which proceeded peacefully, saw the Liberian police facilitate protesters far more extensively. The same was true when over a thousand Liberians took to the streets in December to protest the rising cost of living.",2,"Numerous civil society groups and nongovernmental organizations (NGO), including human rights organizations, operate in the country. However, groups focused on LGBT+ issues tend to keep a low profile due to fears of retribution for their work. A National Aid and NGO policy was introduced in 2020 to improve the coordination of humanitarian aid in the country.",3,"Unions are free to form and mobilize and are well organized. The rights of workers to strike, organize, and bargain collectively are recognized and realized in practice. However, the law does not protect workers from employer retaliation for legal strike activity. Labor disputes can turn violent, particularly at the country’s various mines and rubber plantations.",2
libya,"A 2012 law on freedom of assembly is generally compatible with international human rights principles, but in practice armed conflict and related disorder have seriously deterred peaceful assemblies in many areas. Demonstrators repeatedly gathered in cities across the country between May and August 2022 to protest poor living conditions and political dysfunction. Local militias often responded by violently dispersing the assemblies and arbitrarily detaining organizers.",1,"The number of active nongovernmental organizations (NGOs) has declined in recent years due to armed conflict and the departure of international donors. Militias with varying political, tribal, and geographic affiliations have attacked civil society activists with impunity. Many NGO workers have fled abroad or ceased their activism in the wake of grave threats to themselves or their families. International NGOs, human rights activists, and researchers seeking to work in the country routinely face obstacles such as the denial of entry visas.NGOs in Libya are largely overseen by the Civil Society Commission (CSC), a regulatory body established by the GNA’s Presidential Council in 2018, though administration often differs between the east and west of the country. In July 2022, a court in Benghazi suspended a controversial 2019 decree that granted the CSC wide-ranging authority to restrict, suspend, and dissolve NGOs, but other repressive regulations and Qadhafi-era laws affecting NGOs remained in force.",1,"Some professional and trade unions, having been outlawed under the Qadhafi regime, formed or were revived after 2011 and are able to function under that year’s constitutional declaration. Unions representing oil workers, teachers, bakers, doctors, and other groups have established offices in major cities and coordinate with local chapters across the country. The union movement has been affected by the country’s broader east-west political divide, and workers’ rights have been ignored in practice by successive governments. Labor activists are also subject to violence and intimidation by militia forces, particularly in the east. Nevertheless, unions have sought to defend their interests through a number of strike actions as well as engagement with civil society groups, political figures, and militia leaders.",1
liechtenstein,"The constitution guarantees freedom of assembly, and this right is respected in practice.",4,Domestic and international nongovernmental organizations (NGOs) are able to function freely.,4,"The law facilitates the formation of trade unions and collective bargaining, and workers enjoy freedom of association in practice. The principality has at least one trade union. While a 2008 legal change removed a ban on strikes for civil servants, the right to strike in general is not explicitly protected by law. Major labor disputes are rare in the country.",4
lithuania,"Freedom of assembly is generally respected. In the wake of the nationwide state of emergency declared in February 2022, assemblies supporting the military actions of the Russian or Belarusian regimes in Ukraine were banned.Due to a significant slowdown of the spread of COVID-19, the government in April 2022 announced that restrictions on public gatherings and other events that had been in place would be lifted the next month.",4,"Nongovernmental organizations (NGOs) are able to register without facing serious obstacles, and they generally operate without undue restrictions in practice.",4,"Workers have the right to form and join trade unions and engage in collective bargaining, though there have been reports of employees being punished for attempting to organize. Less than 10 percent of workers are trade union members, and the share of workers covered by collective agreements is similarly low. Changes to the labor code in 2017 required employers with at least 20 workers to initiate the election of a work council to represent employees’ interests, if a union was not already established, though only unions can engage in collective bargaining. Strikes are relatively uncommon due to strict regulations, lack of strike funds, and the absence of a culture of industrial action.",3
luxembourg,Freedom of assembly is guaranteed by the constitution and generally respected in practice.,4,Nongovernmental organizations (NGOs) are largely free to operate without any undue restrictions.,4,Workers are free to organize in trade unions and bargain collectively. The right to strike is guaranteed once conciliation procedures are formally exhausted. Employers are subject to penalties for antiunion discrimination.,4
madagascar,"The constitution guarantees freedom of assembly, but authorities at times decline requests for protests and rallies in the name of public security. Throughout 2022, several meetings of the opposition were banned or forcefully dispersed by the police.",2,"Freedom of association is provided for in the constitution and is generally respected. A wide variety of nongovernmental organizations (NGOs) are active, but many domestic human rights groups lack resources. Although no restrictions are placed on NGOs, the government is not always receptive to their opinions. Groups focused on the environment or human rights face pressure from powerful interests.",3,"Workers have the right to join unions, engage in collective bargaining, and strike. However, more than 80 percent of workers are engaged in agriculture, fishing, and forestry at a subsistence level, and therefore have no access to unions.",3
malawi,"Freedom of assembly is constitutionally guaranteed. Citizen groups can assemble peacefully, although public gatherings require prior police and local government authorization. Demonstrations held in 2022 were mostly peaceful, though protesters and police clashed during a July cost-of-living rally in Lilongwe.",3,"Nongovernmental organizations (NGOs) are active in Malawi, though civil society figures deemed to support the opposition are often subject to intimidation and arrest. A law passed in March 2022 established the NGO Regulatory Authority. Several NGOs protested the legislation, which they said included unduly harsh punishments for violating its provisions. Under the NGO Act, an organization’s registration can be suspended if it is deemed to have departed from its original purpose, engaged in partisan politics, or otherwise violated its provisions.",2,"The right to organize labor unions and to strike are legally protected, though these are limited for workers that offer essential services. Unions are active and collective bargaining is practiced, but retaliation against unregistered unions and strikers is not illegal. No major strikes were reported in 2022.",3
malaysia,"Freedom of assembly can be limited on the grounds of maintaining security and public order. The Peaceful Assembly Act requires advance notice to police of planned events, imposes criminal penalties for violations, lacks provisions to allow spontaneous assemblies, bans those under age 21 from organizing an assembly, and prohibits participation by minors and noncitizens. While demonstrations are often held in practice, police continue to enforce restrictions and investigate participants in allegedly illegal protests.In August 2022, the secretary-general of the Malaysian United Democratic Alliance party was charged under the Peaceful Assembly Act for organizing a protest against a mismanaged naval procurement project, and several others associated with the demonstration were questioned by police.",2,"A wide array of nongovernmental organizations (NGOs) operate in Malaysia and have a strong record of campaigning for electoral, anticorruption, and other reforms. However, NGOs must be approved and registered by the government, which has refused or revoked registrations for political reasons in the past. Numerous activists have been subjected to police harassment and criminal charges—particularly for speech-related offenses—under successive governments.In March 2022, activists from the human rights organization Suara Rakyat Malaysia (SUARAM) and the Coalition for Clean and Fair Elections (BERSIH) were summoned by police over a protest against the proposed Independent Police Conduct Commission, and in April representatives of the NGO Lawyers for Liberty were similarly questioned after their protest against the death penalty outside the Singaporean embassy.",2,"Most Malaysian workers can join trade unions, but the law contravenes international guidelines by restricting unions to representing workers in a single or similar trade. The director general of trade unions can refuse or withdraw registration arbitrarily. Collective bargaining rights are limited, particularly in designated high-priority industries, as is the right to strike. Some private employers engage in antiunion activity. In March 2022, the Electronics Industry Employees Union Northern Region alleged that Molex Malaysia’s management had intimidated employees who were organizing.",2
maldives,"Respect for freedom of assembly is uneven. A 2016 law requires protest organizers to obtain police permission for their events and restricts demonstrations to certain designated areas. In August 2022, three journalists filed a petition with the High Court to request the repeal of this restriction.",2,"Nongovernmental organizations (NGOs) operate in a restrictive environment with limited resources and access to information. In recent years, Maldivian human rights groups have become targets of surveillance, harassment, lawsuits, threats of violence, and blasphemy allegations, including from extremist nonstate actors. Women’s rights and LGBT+ rights advocates, journalists, and bloggers have been targeted online, and the President’s Office has acknowledged that people who report threats often do not feel that their complaints have been adequately addressed. In 2022, Mohamed Rusthum Mujuthaba, a religious freedom and human rights activist, was sentenced to four months in prison on blasphemy charges in relation to his activism online.In April 2022, Solih issued a decree banning the “India Out” campaign, which is associated with the opposition and seeks an end to Indian military presence on the islands. The decision was justified on claims the campaign incited hatred against India and posed a national security threat. In November 2022, President Solih ratified the Associations Act, which includes financial disclosure requirements as well as provisions for a certain amount of state funding to be directed to NGOs. However, because the majority of registered associations are sports related, the funding may not provide significant relief to NGOs working in the human rights field.",1,"The constitution and labor laws allow workers to form trade unions, and several unions are active. However, collective bargaining is not protected under the law, and strikes are prohibited in many sectors, including the crucial tourism industry. Many union leaders face backlash from powerful industry businesses that portray trade unionism negatively.Significant strides, however, have been made. In May 2022, the Teachers Association of the Maldives (TAM), the largest such teacher’s group, won a hard-fought salary increase of 56 percent. Other labor groups have negotiated better working arrangements and trade opportunities in the tourism and fishing industries.",2
mali,"The constitution guarantees freedom of assembly, but participants in public gatherings risk violence by state security forces, and the government has occasionally restricted social media use to prevent activists from organizing protests.Several protests took place in 2022 and were largely peaceful. Numerous progovernment rallies, including protests against ECOWAS sanctions, and demonstrations against French involvement in Mali were held throughout the year without being disrupted. Smaller protests against the military-led government took place in January and May.",2,"Many NGOs have operated in Mali without state interference, but the ability of civil society groups to engage in human rights work has grown increasingly restricted since the 2021 coup. Such groups have reported facing death threats and threats of detention, as well as physical harassment and violence. In November 2022, the government banned all NGOs that received French financing or material or technical support. The ban impacted nearly 300 organizations. In an effort to enforce the ban, the government imposed new reporting requirements on NGOs in December, which included making all NGOs’ funding streams subject to mandatory government review. Separately, in December, the government suspended Geneva Call (Appel de Genève), a Swiss humanitarian organization that was supporting humanitarian dialogue between civilians and former rebels, for alleged “illicit activities.”Ongoing insecurity in some parts of the country hampers NGO efforts to provide aid and services to returning refugees and others affected by instability. In its October 2022 report to the UN Security Council (UNSC), MINUSMA noted frequent interference in its operations by both the government and nonstate actors.",1,"The constitution guarantees workers the right to form unions and to strike, with some limitations for workers in essential services and requirements involving compulsory arbitration. The government has broad discretionary power over the registration of unions and recognition of collective bargaining, and the authorities do not effectively enforce laws against antiunion discrimination.In November 2022, three trade unions, including the country’s largest trade union, the National Union of Workers of Mali (UNTM), held a two-day strike in Gao to condemn the government’s failure to address growing insecurity in the region.",2
malta,"The constitution provides for freedom of assembly, and this right is respected in practice.",4,"Nongovernmental organizations (NGOs), including human rights groups, generally operate without state interference.",4,"The law recognizes the right to form and join trade unions, engage in collective bargaining, and strike. Antiunion discrimination by employers is relatively uncommon.",4
marshall-islands,"The government upholds constitutional guarantees of freedom of assembly. Protests in recent years have addressed issues including climate change, women’s rights, and the legacy of US nuclear weapons tests in the country.",4,"Civil society groups, many of which are sponsored by or affiliated with church organizations and provide social services, operate freely.",4,"Constitutional and legal provisions that protect freedom of association also apply to trade unions. However, there are no laws regulating the right to strike, and few employers are large enough to support union activity among their workers.",3
mauritania,"While the constitution guarantees freedom of assembly, organizers are required to obtain official consent for large gatherings, which is often denied. Government-sponsored protests often occur without incident while opposition and civil society demonstrations are often met with police repression. In October 2022, for example, a protest over the government’s educational reforms was dispersed by the police. However, protests have become less violent in recent years.",2,"Nongovernmental organizations (NGOs), particularly antislavery organizations, frequently encounter intimidation, violence, and repression in carrying out their activities. The Initiative for the Resurgence of the Abolitionist Movement in Mauritania (IRA Mauritania), for example, had been denied permission to register as an NGO since its 2008 formation.In 2021, the parliament passed a new law to replace the Law of Associations of 1964, considerably easing the process to create and register an organization. IRA Mauritania was recognized as a human rights organization that year. The Interior Ministry can still temporarily suspend associations without notice, however. Also in 2021, the government announced the creation of an online platform for registering associations.The Alliance for the Refoundation of the Mauritanian State, which opposes the country’s caste system, has faced government scrutiny, with authorities disrupting meetings and arresting members in recent years.",1,"Workers have the legal right to unionize, but unions require approval from the public prosecutor to operate and often face hostility from employers. The right to collective bargaining is not always respected, and the government sometimes pressures union members to withdraw their membership. The right to strike is limited by notice requirements and other onerous regulations.",2
