Country,Tekst,Skoor,Tekst2,Skoor2,Tekst3,Skoor3
ecuador,"Protests occur regularly throughout the country without incident. However, national security legislation provides a broad definition of sabotage and terrorism, extending to acts against persons and property by unarmed individuals, which can be used to limit assembly rights. In May 2020, the Ministry of Defense issued a regulation authorizing soldiers’ use of lethal force in situations that potentially included protests. Following a challenge by rights groups, the Constitutional Court suspended the regulation that June, pending a full decision. In October 2021, Indigenous communities initiated mass protests as President Lasso proposed an increase in fuel prices. Protesters blocked major roads and were prevented from entering the presidential palace by riot police. In June 2022, CONAIE initiated another demonstration that saw Indigenous activists march to Quito to protest the government’s economic policies and demand that the Lasso administration uphold Indigenous land rights. Though the protests began peacefully, they quickly escalated into “abhorrent violence.” Protesters attacked journalists and security forces; briefly held dozens of security officers captive; and blockaded roads, leading to nationwide fuel and food shortages. President Lasso imposed a state of emergency after the protests began, limiting the freedom of assembly and mobilizing military forces. Authorities responded violently to the protests, using excessive force and arbitrary arrests to repress the demonstrations. Hundreds of protesters and security forces were injured during the 17 days of demonstrations, and at least seven people, including one soldier, were killed.",3,"In 2017, the Moreno administration rescinded controversial Correa-era decrees that heavily restricted nongovernmental organizations (NGOs) and their ability to operate. However, though observers saw improvements under the Moreno administration, many criticized the retention of excessive government regulatory power. Current NGO regulations allow authorities to close organizations perceived to be participating in politics, or organizations deemed to perform activities different from those for which they were created.",3,"Private-sector labor unions have the right to strike, though the labor code limits public-sector strikes. Only a small portion of the general workforce is unionized, partly because many people work in the informal sector.",3
egypt,"Though the constitution guarantees the right to free assembly, the Interior Ministry can legally ban, postpone, or relocate protests with a court’s approval. Unauthorized gatherings of 10 or more people can be dispersed forcefully. Protest organizers must inform police of their plans at least three days in advance. Thousands of protesters have been arrested since these strict laws were introduced in 2013, and some jailed protesters have received death sentences. Because of this crackdown, protests are extremely rare.In November 2022, during the UN Climate Change Conference (COP27), Egyptian authorities arrested and charged at least 138 protesters with joining a terrorist group, spreading false news, inciting terrorist crimes, and misusing social media.",0,"In recent years, nongovernmental organizations (NGOs) have faced mass closures as well as harassment in the form of office raids, arrests of members, lengthy legal cases, and restrictions on travel. A 2019 law constrains the activities of NGOs deemed to threaten national security, public morals, and public order and imposes onerous reporting requirements and intrusive monitoring systems. Punishments for violations of the law are severe.The Arab Network for Human Rights Information (ANHRI) suspended its Egyptian operations in January 2022, claiming its founder had experienced years of harassment from authorities, including freezing of his assets, a travel ban, and physical assault.Political dissidents and human rights defenders abroad experience transnational repression, while their families in Egypt have increasingly faced persecution by state authorities.",0,"The government only recognizes unions affiliated with the state-controlled Egyptian Trade Union Federation. While Article 15 of the constitution provides for the right to organize peaceful strikes, they are not tolerated in practice, and the law on protests prohibits gatherings that impede labor and production. Striking workers have in the past been arrested and prosecuted. Workers at military-owned businesses are subject to trials by military courts. Authorities failed to protect striking workers in 2021, allowing the large manufacturing company LORD International to unfairly dismiss and punish workers on strike.",1
el-salvador,"Freedom of assembly is generally upheld, and public protests and gatherings are permitted. However, the Bukele government has surveilled activists who organize such events, pushing some citizens to refrain from participating due to fear of potential repercussions. The 2022 state of exception has also limited freedom of assembly rights.",3,"NGOs have operated freely and played an important role in society and policymaking in the postwar era. However, they have largely been excluded from engagement with policymakers under the Bukele government and are frequently lambasted by the president and other officials over critical stances toward government policy.In 2021, the Legislative Assembly set up a special commission to investigate NGOs, police and prosecutors raided the offices of seven NGOs on charges of embezzlement, and the government put forward a Foreign Agents Law requiring individuals and organizations to register as foreign agents if their activities “respond to the interests of, or are directly or indirectly funded by, a foreigner” and pay a 40 percent tax on foreign payments. Ruling-party legislators and government officials explicitly linked the law to funding given to investigative journalism that is critical of the government and recent protest marches. In the face of massive pressure, not least by the diplomatic corps and foreign donors, the government delayed voting on the law.The government targeted several nongovernmental human rights organizations using Pegasus spyware in 2020 and 2021, according to a January 2022 report. Under the state of exception implemented in March 2022, authorities have clamped down on programs to support rehabilitation and reintegration of formerly incarcerated persons.",2,"Labor unions have long faced obstacles in a legal environment that favors business interests, including by mandating only light penalties for employers who interfere with strikes. The law prohibits strikes in sectors deemed essential, and the designation is vaguely defined.",2
equatorial-guinea,"Freedom of assembly is severely restricted. Opposition gatherings are typically blocked or dispersed by security forces, and citizens are sometimes pressured to attend progovernment events.In June 2022, a rally organized by the CPDS was banned by the authorities. In September, Leoncio Prisco Eko Mba, a rapper also known as Adjoguening who had criticized the government in his lyrics, was arrested while staging a protest to demand that officials restore his confiscated passport. He was held for a month without charges.",0,"All associations must register with the government through an onerous process, and independent nongovernmental organizations (NGOs) face state persecution. In 2019, the Center for Studies and Initiatives for the Development of Equatorial Guinea (CEID-GE) was dissolved by government decree.Among those arrested in the broader preelection crackdown in September 2022 were human rights activists Luis Nzó Ondo and Anacleto Micha Nlang. Another civil society activist, Joaquin Elo Ayeto, was arrested in December.",0,"The constitution provides for the right to organize unions, but there are many legal and practical barriers to union formation, collective bargaining, and strikes. The government has refused to register several trade unions; a farmers’ organization is the only legal union.",0
eritrea,Freedom of assembly is not recognized by the authorities. Public gatherings of more than seven people require a permit. Those who protest face the threat of deadly force at the hands of state security officers or arbitrary detention.,0,"The law requires all nongovernmental organizations (NGOs) to undergo an onerous and arbitrary annual registration process and limits their activities to providing humanitarian relief. In reality, there are no independent NGOs based in Eritrea. The government continues to deny permission for external human rights organizations to enter the country.",0,"While the Eritrean government has ratified the International Labour Organization’s eight fundamental conventions, no independent trade unions function in Eritrea. The only union umbrella group, the National Confederation of Eritrean Workers, is affiliated with the PFDJ. According to reports to the UNHRC, the government has prevented new unions from being formed.",0
estonia,"The constitution guarantees freedom of assembly, and the government upholds this right in practice.",4,The government upholds freedom of association and does not restrict or control the activities of nongovernmental organizations (NGOs).,4,"The law recognizes workers’ rights to organize, strike, and bargain collectively, although public servants at the municipal and state levels may not strike. While these rights are largely upheld in practice, union membership is low, and employers in some sectors have resisted bargaining efforts.",4
eswatini,"Freedom of assembly is restricted. Surveillance of protests is common, and the information collected is reportedly used to deny protesters access to government jobs and services. Demonstrations are often violently dispersed by police, and protesters risk arrest and detention. Nevertheless, labor and prodemocracy protests have taken place in spite of these risks. Demonstrations that are not perceived as a direct challenge to the king have been allowed to go forward. Widespread prodemocracy protests continued into 2022 despite an official ban on protests issued in October 2021. The protests began in May 2021 and escalated that June after Mswati banned citizens from petitioning the government. Security forces attempted to suppress the demonstrations, subjecting peaceful protesters to arbitrary arrests and using indiscriminate force to disperse gatherings, resulting in the deaths of more than 80 people; hundreds more were hospitalized for their injuries. This crackdown on dissent continued in 2022. During the year, security forces attempted to forcibly disperse protesters by shooting tear gas, rubber bullets, and live ammunition into crowds. Protesters also faced arbitrary arrest and physical assaults by security forces. Student activist Colani Maseko, whose January arrest had prompted a wave of demonstrations, was arrested again in May while participating in a protest; he was allegedly tortured following his arrest. Maseko was later hospitalized from injuries sustained while he was detained.",0,"The operation of nongovernmental organizations (NGOs) has been inhibited by broadly written sedition and terrorism laws as well as police monitoring and interference. Organizations that advocate for democracy remain banned. Despite such restrictions, it appears there is limited tolerance of some forms of human rights–based legal activism. For example, Women and Law Southern Africa–Swaziland was allowed to bring a case on gender equality in divorce settlements, with the court deciding in its favor in 2019. In 2020, an LGBT+ advocacy organization that had been denied official registration challenged the rejection in court. The High Court ultimately upheld the rejection when it ruled against the organization, Eswatini Sexual and Gender Minorities (ESGM), in April 2022, stating that although the constitution guarantees fundamental rights “irrespective of gender or sex,” those rights are subject to Eswatini’s laws, which do not permit same-sex relations. One judge dissented, saying that the rejection was executed in a “grossly irregular manner.”",1,"Eswatini has active, vocal labor unions, but workers’ rights are poorly upheld in practice. Although workers in most sectors, with the exception of essential services defined by the labor minister, can join unions, strikes and other labor activism routinely trigger crackdowns and arrests by the police. A number of prodemocracy activists and former trade unions are exiled in South Africa.",1
ethiopia,"Free assembly is restricted by insecurity in several regions and associated declarations of states of emergency or martial law. The nationwide state of emergency enacted in November 2021 that lasted until February 2022 further curtailed freedom of assembly and other civil liberties throughout the country.Government forces continued to violently disperse protests throughout 2022. In May, federal police used tear gas and gunfire to disperse rioters after clashes between police and Muslim worshippers occurred at Meskel Square in Addis Ababa during the Eid al-Fitr prayer.",1,"Under a civil society law passed in 2019, the federal Authority for Civil Society Organizations (ACSO) retains broad powers. Moreover, while nongovernmental organizations (NGOs) are more able to legally operate in the human rights and governance spheres, practically many of these organizations are unable to access large parts of Ethiopia either due to security challenges or a lack of official approval, as was the case in Tigray. While the discourse around NGOs is more open, many of the practical realities for these groups have not improved. Local civil society organizations (CSOs) face threats and warnings for advocating for issues contrary to the government’s position, especially in relation to internal conflicts. In September 2022, government security agents prevented a group of 35 CSOs from hosting a press event with media representatives, in which they were to call for warring parties in Ethiopia to end the violence and come to the negotiate a peace deal. The organizations instead independently issued a statement calling for the cessation of violence in Tigray. Days later, the government threatened to revoke the licenses of the organizations involved, claiming they had acted against the “sovereignty of the country and the public interest.”",1,"The Ethiopian Constitution recognizes the right of workers to join trade unions, and more than 500,000 workers are organized under the umbrella of the Confederation of Ethiopian Trade Unions (CETU). However, independent unions have faced harassment in the past, and there has not been a legal strike in Ethiopia since 1993.

On the employer side, a large number of chambers of commerce and business associations exist for different industries and locations. The largest and oldest among them, the Addis Ababa Chamber of Commerce, is a regular critic of government economic policy. The federally organized Ethiopian Chamber of Commerce, of which the Addis chamber is a member, has been more aligned with official policy.",1
fiji,"The constitution gives the government wide latitude to prohibit protests, including on the basis of public safety and morality. Fiji has refused entry into the country for the United Nations Special Rapporteur on the rights to freedom of assembly since 2014.",2,"Fiji has an extensive nongovernmental organization (NGO) network, which largely operates without government interference. However, strict sedition laws, which criminalize criticism of the government, place constraints on the range of initiatives that NGOs can undertake. In May 2022, Bainimarama criticized two of Fiji’s longstanding NGOs—the Fiji Women’s Crisis Centre and the Foundation for Rural Integrated Enterprises and Development (FRIEND)—calling them political opposition groups rather than NGOs after the organizations voiced support for a nonpartisan caretaker government to see the country through the December elections.",3,"Restrictions on trade union protests remain. The Fiji Trades Union Congress (FTUC) has been denied permits for marches numerous times in recent years.Union members’ political activities are also restricted: they are prohibited from becoming members of Parliament and face obstacles to joining political parties. General secretary of the National Workers Union and the FTUC, Felix Anthony, appeared in court in April and November 2021 over his activities during a 2019 protest by water authority workers. Amnesty International reported a rise in harassment of trade unionists in the leadup to these protests and other important union meetings.",2
finland,"Freedom of assembly is protected by law and upheld in practice. In October 2020, police used pepper spray against protesters obstructing traffic, who were associated with the environmental activist group Extinction Rebellion and calling on the government to take more significant measures to combat the climate crisis. Seven police officers were charged in connection with the incident in June 2022.As of early 2022, 48 protesters were being investigated for invasion of public premises.",4,Nongovernmental organizations (NGOs) operate without restriction.,4,"Workers have the right to organize and bargain collectively, though public-sector workers who provide services deemed essential may not strike. Approximately 75 percent of workers belong to trade unions, which actively advocate for members’ interests. In September, parliament passed the Patient Safety Act, which restricts nurses’ right to strike. It nearly led to mass resignations within the nursing sector, and suggests attempts to restrict the right to organize within some sectors.",4
france,"Freedom of assembly is normally respected, though authorities have used excessive force when dealing with political protests in recent years.",3,"Nongovernmental organizations (NGOs) generally operate freely. However, the LGS and LRPR have complicated and obstructed NGO reports around protests and police actions.The LRPR eased authorities’ ability to disband associations that allegedly disrespect so-called “values of the Republic.” The law has been used to target organizations that seek to combat Islamophobia.In March 2022, the interior minister ordered the dissolution of the Antifacist Group of Lyon and Surroundings (GALE), saying that it meant to incite violence. In May, however, the Council of State suspended that decision, citing a lack of evidence that GALE intended to disturb public order. In September, the prefect of Vienne cited the LRPR when calling on authorities in the city of Poitiers to withdraw public funding from Alternatiba, an environmental NGO; Alternatiba planned to hold workshops on civil disobedience. The mayor declined, prompting the prefect to sue over the legality of the funding in October.",3,"Trade unions are generally free to operate without undue restrictions. Social movements like the Yellow Vests of the late 2010s—despite rejecting affiliations with trade unions or political parties—and the formation of NUPES have provided momentum for trade union activism. In October 2022, oil workers, rail workers, and civil servants held strikes over pay, disrupting domestic travel.",4
gabon,"Freedom of assembly is limited. The government has repeatedly denied permits for meetings, used tear gas, and arrested demonstrators to disperse unauthorized gatherings. A 2017 law further limited the freedom to assemble by making organizers responsible for offenses committed during gatherings. In May 2022, authorities stopped protesters from rallying against the presence of French troops in the country.",1,"Relatively few NGOs operate in Gabon. Freedom of association is guaranteed by the constitution, but the process for formally registering NGOs is onerous and implemented inconsistently, leaving groups vulnerable to accusations that they are not in compliance with the law.",1,"Workers are legally permitted to join unions, engage in collective bargaining, and strike, but the government has disrupted sit-ins and other labor activism in recent years, and has arrested participants.In February 2022, civil-service union leader Jean-Rémy Yama was blocked from leaving the country and was detained by the Gabonese intelligence service. In early March, Yama was handed politically motivated corruption charges. Yama, who was forced out of the civil service in late March, remained in detention at year’s end.",1
gambia,"The constitution guarantees freedom of assembly, but the POA requires event organizers to obtain police permits for public assemblies. In the white paper it released in May 2022 on the findings of the Truth, Reconciliation, and Reparations Commission (TRRC), the government accepted the commission’s recommendation to review the POA to ensure that it aligned with international human rights standards. During 2022, protests over deteriorating environmental conditions were denied permits, ostensibly over security concerns. When the protests proceeded without permits, they were met with an armed police presence. In September 2022, commercial drivers protesting bridge-crossing fees were arrested.",2,"There are several nongovernmental organizations (NGOs) in The Gambia that focus on human rights and governance issues. NGO workers faced detention and other reprisals under Jammeh, and restrictive legislation remains on the books, but since 2017 NGOs have operated with less interference in practice, and some groups have successfully challenged the government on policy and legal matters without repercussion. International NGOs have also increased their presence in the country and are able to operate without interference.",2,"Workers—except for civil servants, household workers, and security forces—may form unions, strike, and bargain for wages, but the labor minister has the discretion to exclude other categories of workers. The Gambia has multiple trade unions that operate without government restrictions, though several lack organization and funds.",2
georgia,"Freedom of assembly is upheld unevenly, with police sometimes responding to demonstrations with excessive force. In 2022, there were large-scale rallies in favor of Georgia’s EU membership bid, and against the authorities for their failure to secure EU candidate status.LGBT+ groups’ right to assembly is rarely protected. In July 2021, anti-LGBT+ rioters met little resistance from police when they broke into the offices of Tbilisi Pride, destroying property and attacking journalists. The Pride rally did not take place in 2022.",2,"Civil society is fairly robust. Some groups are included in policy discussions, though others face political pressure including criticism and exclusion from policy dialogue. In December 2022, several parliamentarians proposed a “foreign agents” law that would place extra scrutiny on some civil society groups. In 2021, civil society advocates were revealed to be targets of state surveillance. In 2022, the Georgian government established parliamentary groups to work on reforms necessary for EU candidacy status, but civil society groups were excluded from these processes.",3,"Workers are legally allowed to organize, bargain collectively, and strike, though there are some restrictions on the right to strike, including a ban on strikes by certain categories of workers. Legal protections against antiunion discrimination by employers are weak and poorly enforced in practice.",2
germany,"The right to peaceful assembly is enshrined in the constitution and is generally respected in practice, except in the case of outlawed groups, such as those advocating Nazism or opposing democratic order.Several large protests took place in Germany during 2022, including widespread demonstrations against rising energy prices, growing inflation, and cost of living increases. Additionally, large demonstrations against COVID-19 measures, which have been held regularly since 2020, continued in 2022. Some of these demonstrations have turned violent; since mid-2020, far-right Querdenken protesters have assaulted several journalists and repeatedly clashed with police and counterprotesters.",4,"Germany has a vibrant sphere of nongovernmental organizations (NGOs), which operate freely. In December 2020, the parliament passed a revised tax law that explicitly allowed more NGOs operating in areas including climate change and LGBT+ issues to claim tax-exempt status.",4,"Trade unions, farmers’ groups, and business confederations are generally free to organize, and play an important role in shaping Germany’s economic model.",4
